{
  "schema_version": "0.2.0",
  "run_id": "RUN-20260910-BA-M02-SCOPE",
  "track": "BA",
  "module_id": "BA-M02",
  "status": "DRAFTED",
  "completed_artifacts": [
    "contracts/business-analyst/BA-M02-contract.json",
    "production/drafts/BA-M02/BA-M02-word-budget.md",
    "production/drafts/BA-M02/BA-M02-C01.md",
    "production/drafts/BA-M02/BA-M02-C02.md",
    "production/drafts/BA-M02/BA-M02-C03.md",
    "production/drafts/BA-M02/BA-M02-C04.md",
    "governance/03-change-log.md",
    "governance/04-version.json"
  ],
  "open_issues": [
    "ISS-001"
  ],
  "next_action": "Review production/drafts/BA-M02/BA-M02-C04.md and its review PDF; resolve critical conceptual gaps before beginning BA-02-C05 or any later phase.",
  "updated_at": "2026-09-10"
}
