{
  "schema_version": "0.2.0",
  "run_id": "RUN-20260910-BA-M16-SCOPE",
  "track": "BA",
  "module_id": "BA-M16",
  "status": "OUTLINED",
  "completed_artifacts": [
    "business-analyst/00-business-analyst-blueprint.md",
    "contracts/business-analyst/BA-M16-contract.json",
    "indexes/00-master-index.json",
    "indexes/01-cross-reference-register.md",
    "indexes/02-glossary-register.md",
    "governance/03-change-log.md",
    "governance/04-version.json"
  ],
  "open_issues": [
    "ISS-001"
  ],
  "next_action": "Approve BA-M16 chapter word budgets and begin the controlled theory phase with BA-16-C01 only.",
  "updated_at": "2026-09-10"
}
