{
  "schema_version": "0.2.0",
  "run_id": "RUN-20260910-ROADMAP-GAP-BA",
  "track": "BA",
  "module_id": "BA-M05",
  "status": "PLANNED",
  "completed_artifacts": [
    "indexes/03-roadmap-sh-coverage-gap-report.md"
  ],
  "open_issues": [
    "ISS-003"
  ],
  "next_action": "Architecture owner reviews and approves or rejects the Business Intelligence Priority 1 candidates in REF-AUDIT-20260910-01 before any blueprint or contract change.",
  "updated_at": "2026-09-10"
}
