{
  "schema_version": "0.2.0",
  "run_id": "RUN-20260910-BA-M01-PHASE1",
  "track": "BA",
  "module_id": "BA-M01",
  "status": "DRAFTED",
  "completed_artifacts": [
    "contracts/business-analyst/BA-M01-contract.json",
    "governance/03-change-log.md",
    "governance/04-version.json",
    "production/drafts/BA-M01/BA-M01-word-budget.md",
    "production/drafts/BA-M01/BA-M01-C01.md"
  ],
  "open_issues": [
    "ISS-001"
  ],
  "next_action": "Perform an independent theory review of BA-M01-C01; resolve critical conceptual gaps before approving Phase 2 or beginning BA-01-C02.",
  "updated_at": "2026-09-10"
}
