{
  "schema_version": "0.2.0",
  "run_id": "RUN-20260910-0001",
  "track": "DS",
  "module_id": "DS-M01",
  "status": "OUTLINED",
  "completed_artifacts": [
    "contracts/data-science/DS-M01-contract.json"
  ],
  "open_issues": [
    "ISS-001"
  ],
  "next_action": "Approve DS-M01 chapter word budgets and lab specifications.",
  "updated_at": "2026-09-10"
}
